{
  "$schema": "https://json-schema.org/draft/2020-12/schema",
  "$id": "https://aaronwriight.com/schemas/writing-post.json",
  "title": "Unified SFI and Venture Author Post",
  "description": "The author-owned metadata contract. Draft values may be empty or null; the writing review and publish commands enforce publication completeness.",
  "type": "object",
  "additionalProperties": false,
  "required": [
    "$schema",
    "source",
    "title",
    "subtitle",
    "excerpt",
    "entry",
    "date",
    "time",
    "location",
    "trip",
    "thread",
    "slug",
    "music",
    "tags",
    "blog",
    "collections",
    "latitude",
    "longitude",
    "status"
  ],
  "properties": {
    "$schema": {
      "type": "string"
    },
    "source": {
      "description": "Relative filename of the one active author body inside this post folder. Native drafts use entry.md, entry.html, or entry.txt. A Word import is converted immediately to editable HTML named <full-slug>.html; the preserved .docx manuscript is an inactive snapshot.",
      "oneOf": [
        { "type": "null" },
        { "enum": ["entry.md", "entry.html", "entry.txt"] },
        {
          "type": "string",
          "pattern": "^[0-9]{4}-[a-z0-9]+(?:-[a-z0-9]+)*-[0-9]{8}\\.html$"
        }
      ]
    },
    "title": {
      "description": "The journal or post title.",
      "type": ["string", "null"]
    },
    "subtitle": {
      "description": "The entry subtitle shown in the site header and indexes.",
      "type": ["string", "null"]
    },
    "excerpt": {
      "description": "A short, plain-text summary used in indexes and newsletters. Leave it empty while drafting to derive up to 150 characters from the first two meaningful prose paragraphs on first publish.",
      "type": ["string", "null"]
    },
    "entry": {
      "description": "The global SFI/Venture sequence number. It is a string so leading zeroes are preserved.",
      "type": "string",
      "pattern": "^[0-9]{4}$"
    },
    "date": {
      "description": "Publication date in YYYY-MM-DD form. Leave it empty while drafting to stamp it on first publish, or supply a date for a retrospective entry.",
      "oneOf": [
        { "type": "null" },
        { "const": "" },
        { "type": "string", "format": "date" }
      ]
    },
    "time": {
      "description": "Publication time in 24-hour HH:MM form. It is normally empty or null while drafting; first publish replaces any draft value with its stamp, and replacement publication preserves that stamp.",
      "oneOf": [
        { "type": "null" },
        { "const": "" },
        {
          "type": "string",
          "pattern": "^([01][0-9]|2[0-3]):[0-5][0-9]$"
        }
      ]
    },
    "location": {
      "type": ["string", "null"]
    },
    "trip": {
      "description": "Optional trip or grouping name for either blog. Venture posts require one before publication.",
      "type": ["string", "null"]
    },
    "thread": {
      "description": "Optional slug shared by posts that belong to the same story or trip thread.",
      "oneOf": [
        { "type": "null" },
        {
          "type": "string",
          "pattern": "^[a-z0-9]+(?:-[a-z0-9]+)*$"
        }
      ]
    },
    "slug": {
      "description": "A unique NNNN-title-subtitle-YYYYMMDD slug derived from entry, title, subtitle, and date. An undated draft uses a provisional date suffix that is finalized on first publish. A manual override requires an explicit date.",
      "oneOf": [
        { "type": "null" },
        { "const": "" },
        {
          "type": "string",
          "pattern": "^[0-9]{4}-[a-z0-9]+(?:-[a-z0-9]+)*-[0-9]{8}$"
        }
      ]
    },
    "music": {
      "description": "Optional music tagline. Review requires a non-empty title and artist whenever this object is present.",
      "oneOf": [
        { "type": "null" },
        {
          "type": "object",
          "additionalProperties": false,
          "required": ["title", "artist"],
          "properties": {
            "title": { "type": ["string", "null"] },
            "artist": { "type": ["string", "null"] },
            "album": { "type": ["string", "null"] },
            "url": {
              "oneOf": [
                { "type": "null" },
                { "const": "" },
                {
                  "type": "string",
                  "format": "uri",
                  "pattern": "^[Hh][Tt][Tt][Pp][Ss]?://"
                }
              ]
            }
          }
        }
      ]
    },
    "tags": {
      "type": "array",
      "items": { "type": "string", "minLength": 1 },
      "uniqueItems": true
    },
    "blog": {
      "description": "The entry's specialized home. Venture entries also belong to the SFI umbrella archive.",
      "enum": ["sfi", "venture"]
    },
    "collections": {
      "description": "Optional collection slugs such as northeast-115, national-parks, or travels.",
      "type": "array",
      "items": {
        "type": "string",
        "pattern": "^[a-z0-9]+(?:-[a-z0-9]+)*$"
      },
      "uniqueItems": true
    },
    "latitude": {
      "oneOf": [
        { "type": "null" },
        { "type": "number", "minimum": -90, "maximum": 90 }
      ]
    },
    "longitude": {
      "oneOf": [
        { "type": "null" },
        { "type": "number", "minimum": -180, "maximum": 180 }
      ]
    },
    "status": {
      "description": "Lifecycle state managed by the writing commands. Unpublished entries retain their original publication metadata and author files while their local generated records are withdrawn.",
      "enum": ["draft", "unpublished", "published"]
    }
  }
}
