{
  "$schema": "../../post.schema.json",
  "source": "0001-scope-for-imagination-an-ode-to-slow-living-20260826.html",
  "title": "Scope for Imagination",
  "subtitle": "an ode to slow living",
  "excerpt": "Hi, friend! :) It’s been a while –– years, actually –– since I’ve devoted to some sort of blog/digital journal (or whatever you call these)…",
  "entry": "0001",
  "date": "2026-08-26",
  "time": "15:12",
  "location": "Kansas City, MO",
  "trip": null,
  "thread": null,
  "slug": "0001-scope-for-imagination-an-ode-to-slow-living-20260826",
  "music": {
    "title": "Water & Wanderlust",
    "artist": "Yebba",
    "album": "Jean"
  },
  "tags": [
    "sfi",
    "reflections"
  ],
  "blog": "sfi",
  "collections": [],
  "latitude": null,
  "longitude": null,
  "status": "published"
}
